id,statement,option1,option2,option3,option4,option5,correct_answer,correct_answers,explanation,erro_alternative1,erro_alternative2,erro_alternative3,erro_alternative4,erro_alternative5,source
747,"Harriet manages a visible program with negative stakeholders. What's the
best communication method to address their concerns?",Face-to-face,Many-to-many,Ad hoc conversation,One-to-many,,1,,,,,,,,1500_questions.txt
748,Which scenario best illustrates transference?,Hiring a trainer for dangerous tasks,Partnering with a competitor for an opportunity,Meeting a deadline for government review,Hiring a consultant for unfamiliar technology,,4,,,,,,,,1500_questions.txt
749,"A company evaluates programs by benefit-cost ratios: 2.2, 1.3, 0.8, 1.6.
Which is most likely chosen?",\* 2.2,\* 1.3,\* 0.8,\* 1.6,,1,,"Higher BCR indicates better value, so 2.2 is preferred.",,,,,,1500_questions.txt
750,"You're identifying stakeholders for a software program affecting
multiple departments. Sarah, a key stakeholder, doubts its scope and
prefers separate apps. How do you classify her?",Active,Negative,Positive,Passive,,2,,"Negative stakeholders resist or oppose the project's goals or scope,
requiring careful engagement and management.",,,,,,1500_questions.txt
751,"A project undergoes an audit to confirm adherence to company policies.
Which process is taking place?",Audit Schedule,Plan Quality Management,Control Quality,Manage Quality,,4,,,,,,,,1500_questions.txt
752,"You've joined Grapevine Vineyards as a contract project manager to
oversee procurement planning tasks, including doubling fermenting tanks,
expanding the warehouse with strict temperature controls, and designing
a visitor center with a tasting room and gift shop. The tasting room's
bar requires specialty marble, sourced from only two global locations,
per Grapevine's directive. Management estimates a three-year timeline.
What factors might your concern about the marble's availability affect?
(Select three.)",The project timeline could be impacted by this concern.,The make-or-buy decision might hinge on this issue.,Your company's business cycle could influence this matter.,The budget determination process might be affected by this.,,,"1,2,3","The project schedule and procurement planning are intertwined. The
marble's scarcity could sway make-or-buy choices and be influenced by
business cycles, affecting resource availability and timing.",,,,,,1500_questions.txt
753,"Dinah manages a project a few months in, poised to enter its first
execution phase. During planning, her sponsor flags overlooked
stakeholders. What's her next step?",\* Kick off execution while scheduling a stakeholder meeting.,"\* Promptly reach out, apologize, and evaluate the overlooked
stakeholders.",\* Assess if the oversight has harmed project goals.,\* Arrange a stakeholder briefing to update them.,,2,,"Identifying all stakeholders early is critical, but oversights happen.
Dinah should swiftly address this by contacting them, expressing regret,
and analyzing their stance to mend relations and align expectations.",,,,,,1500_questions.txt
754,"David, a seasoned project manager at a prominent publishing house, often
works with assertive sponsors. At a recent meeting, his sponsor erupted
over a delay caused by a key team member's illness, hurling insults at
David's competence. Remaining composed, David promised a contingency
plan and suggested a private chat, dismissing the team. What core value
did he exemplify?",Respect,Fairness,Honesty,Responsibility,,1,,"Respect entails maintaining professionalism and self-control, even under
pressure. David managed his reaction, not others' actions.",,,,,,1500_questions.txt
755,"In daily planning meetings, a project manager and a business analyst
frequently clash more than others. Which is LEAST likely to spark their
disputes?",Personality differences,Work style preferences,Limited resources,Task scheduling priorities,,1,,"Common conflict triggers include work styles, resource scarcity, and
scheduling, not typically personality clashes alone.",,,,,,1500_questions.txt
756,"Trista is evaluating major risks in a construction project, having
assessed their impacts, categorized them, and scored their risk ratings.
What's her next move?",\* Monitor and review risks.,\* Identify additional risks.,\* Address risk treatments.,\* Evaluate the risks.,,4,,"After analysis, risk evaluation compares results to criteria, deciding
further actions. Trista's already identified and assessed risks;
evaluation precedes treatment.",,,,,,1500_questions.txt
757,"A project manager navigates a project shrouded in uncertainty, with
scope clarity emerging over time. How should they frame an iterative
approach to the team?","Expect short feedback cycles and backlog reprioritization across
iterations.","Work will evolve gradually, with quarterly feedback loops.","Features will be locked upfront, with work breakdown refined later.",The team will tackle backlog from the bottom up to adapt priorities.,,1,,"Iterative methods thrive on quick feedback and backlog adjustments,
enabling rapid adaptation to changes.",,,,,,1500_questions.txt
758,Benchmarking is a technique employed in which process?,Inspections,Root cause analysis,Plan Quality Management,Perform Quality Control,,3,,"Benchmarking compares practices to peers, aiding in setting standards
and spotting improvements, key to planning quality.",,,,,,1500_questions.txt
759,"How many communication channels exist with 35 stakeholders involved in
your project?",595,600,613,630,,1,,"Using the formula n(n-1)/2, where n is 35 (including you), it's 35\*34/2
= 595 channels.",,,,,,1500_questions.txt
760,"A project manager notices a team member bypassing them to update the
client on deliverables and progress. What's the best response?",Share the resource breakdown structure (RBS) with the team member.,Raise it at the next progress meeting.,Present the RACI chart to clarify roles.,Email the client daily with team updates.,,3,,"The RACI chart defines who's responsible, accountable, consulted, and
informed, curbing unauthorized communication.",,,,,,1500_questions.txt
761,"Gary, scrum master for a software project, must deliver an MVP every
four-week sprint. Leading a 15-member team, eight with prior experience,
he faces a looming deadline in three days. The team doubts they'll hit
it. What likely caused this delay?",\* The sprint was too brief.,\* Too many team members were assigned.,\* The project scope exceeded team capacity.,\* Excessive small user stories muddled client needs.,,2,,"Scrum teams ideally range from 3-9 members, excluding scrum master and
product owner. Fifteen complicates communication, likely slowing
progress.",,,,,,1500_questions.txt
762,"In a functional organization, managing multiple projects often falters
due to what primary challenge?",The project manager's authority level,Competing project priorities over scarce resources,Team focus on functional roles over project goals,Need for informal conflict resolution skills,,2,,"Resource conflicts escalate when limited assets are split across
projects, a hallmark of functional structures.",,,,,,1500_questions.txt
763,"As scrum master in a newly agile-adopting firm, you're coaching on roles
and processes. Who primarily clears general team blockers in scrum?",\* The scrum master,\* The development team,\* The product owner,\* The sponsor,,1,,"In scrum, the scrum master tackles impediments, freeing the team to
focus on delivery.",,,,,,1500_questions.txt
764,"A project manager oversees a project in a remote international site. A
national event during execution raises concerns of negative impacts.
After consulting the program manager, resources for a contingency plan
are secured. What strategy is this?",Escalate,Transfer,Mitigate,Accept,,1,,"Escalating to the program manager for resources reflects an escalation
strategy.",,,,,,1500_questions.txt
765,"A complex project nears closure with mixed team experiences.
Stakeholders may not collaborate again. How should the project manager
fulfill the lessons learned requirement?",Log only negatives for future alternatives.,Host a session on positives alone.,Gather phased feedback from all stakeholders.,Document both positives and negatives using issue logs.,,4,,"Capturing both successes and challenges via logs ensures comprehensive
lessons learned.",,,,,,1500_questions.txt
766,"Kenneth, product owner at a risk-averse firm, needs to risk-adjust the
backlog. What's his first key data point?",\* Full user story details,\* Expected customer numbers in two years,\* Team delivery costs,\* Projected financial return,,4,,"Financial return drives risk-adjusted prioritization in a cautious
company.",,,,,,1500_questions.txt
767,"Which process involves a project manager and risk manager prioritizing
project risks?",Identify Risks,Perform Qualitative Risk Analysis,Perform Quantitative Risk Analysis,Plan Risk Management,,2,,"Qualitative analysis prioritizes risks by likelihood and impact for
further action.",,,,,,1500_questions.txt
768,"You lead a thriving project management group of vocal consultants. What
leadership style suits them best?",\* Coaching for ongoing growth,\* Transactional with rewards for performance,\* Autocratic for results-driven focus,\* Hands-off with high trust,,4,,"A successful, opinionated group thrives under a trusting, hands-off
approach.",,,,,,1500_questions.txt
769,"The project scope statement and resource calendars feed into which Time
Management process?",Sequence Activities,Estimate Activity Resources,Develop Schedule,Control Schedule,,3,,These inputs help shape the project schedule.,,,,,,1500_questions.txt
770,"Christopher's horticultural firm aims to swap plastic pots for
biodegradable ones in nine months, backed by \$10M from upper
management. How should he deepen ties with them?",\* Manage closely,\* Monitor,\* Keep satisfied,\* Keep informed,,1,,"High-power, high-interest stakeholders like management need close
engagement.",,,,,,1500_questions.txt
771,"Dave, managing a project at LGN, Inc., finds Sam's efficiency lagging
despite improved communication post-review. What should Dave do?",\* Wait for the next evaluation.,\* Tell peers Sam's slow pace is due to meticulousness.,"\* Coach Sam on communication and efficiency while assessing project
status.",\* Note his communication gain but flag his slowness.,,3,,Dave must boost Sam's skills and monitor project impact proactively.,,,,,,1500_questions.txt
772,"In a project's final stretch, the manager compares deliverables to a
past project, spotting repeated errors. What needs improvement?",Lessons learned techniques,Scope statement clarity,WBS creation,Quality control application,,1,,Better lessons learned would prevent recurring mistakes.,,,,,,1500_questions.txt
773,"A stakeholder demands a valuable feature addition without altering
scope, budget, or timeline. Approving it extends both. What process was
skipped?",Change management,Schedule and cost management,Product scoping,Requirements definition,,1,,Change management ensures scope shifts are formally assessed.,,,,,,1500_questions.txt
774,"Which interpersonal and team skills can a project manager use to lead
the team? (Select three.)",Conflict management,Emotional intelligence,Influencing,Project management information system,,,"1,2,3","These skills---conflict management, emotional intelligence, and
influencing---drive team success.",,,,,,1500_questions.txt
775,Projects split into phases typically include which sequence?,"Feasibility, concept, design, prototype","Initiate, plan, execute, monitor","Charter, activities, stakeholder expectations, performance","Stakeholders, concept, build, test",,1,,These phases reflect a standard project lifecycle.,,,,,,1500_questions.txt
776,"Jillian oversees Threads Three at Hospital Clothing, revamping order
processing. Stakeholders Jay and Alisha clash on requirements. Jillian
facilitates a resolution meeting. What technique did she use?",\* Interpersonal skills,\* Active listening,\* Stakeholder resolution,\* Management skills,,1,,"Interpersonal skills, like conflict resolution, helped her bridge
differences.",,,,,,1500_questions.txt
777,"Frances, new to agile at an educational software firm, seeks scheduling
advice from his mentor, who suggests on-demand scheduling. What does it
rely on?",\* A fixed schedule from stakeholder needs,\* Critical path dependencies,\* The project manager's expertise,\* A prioritized product backlog,,4,,"On-demand scheduling pulls work from a prioritized backlog as resources
free up.",,,,,,1500_questions.txt
778,"How do servant leaders, as agile role models, approach their work?
(Select three.)",They define purpose with the team's \'why.\',They measure outcomes against planned results.,They foster a people-centric success environment.,They prioritize process for results.,,,"1,3,4","Servant leaders focus on purpose, people, then process, serving the team
selflessly.",,,,,,1500_questions.txt
779,"You've set cost estimates for project activities, forming a baseline to
track variances. Which process established this?",Determine Budget,Develop Costs,Cost Control,Estimate Costs,,1,,Determine Budget locks in the cost baseline.,,,,,,1500_questions.txt
780,What's the tangible outcome of quantitative risk analysis?,Overall project risk exposure assessment,Probability and impact per risk,Priority level per risk,List of potential responses,,1,,"Quantitative analysis updates the risk register with exposure and
probabilistic insights.",,,,,,1500_questions.txt
781,"Organizational process asset updates from Control Scope exclude which
item?",Variation causes,Lessons learned,Work authorization system,Reasons for corrective actions,,3,,Work authorization isn't updated in scope control.,,,,,,1500_questions.txt
782,Control accounts serve what purpose?,Track personnel time charges,Sum costs at WBS level 2,Monitor management reserves,Measure performance at a basic level,,4,,"Control accounts integrate scope, budget, and schedule for performance
tracking.",,,,,,1500_questions.txt
783,"After change control yields 10 approved requests, what's the next
process?",Perform Integrated Change Control,Manage Project Knowledge,Direct and Manage Project Work,Develop Project Management Plan,,3,,Approved changes are executed via Direct and Manage Project Work.,,,,,,1500_questions.txt
784,"Larissa's Project SOV hit its \$220,000 cost baseline, with execution
done and customer acceptance gained. She's closing procurements and
plans to review other baselines Monday. What's the project's status?","\* Complete, as budget was met.","\* Incomplete, lacking scope validation.","\* Complete, with customer acceptance.","\* Incomplete, pending final reporting.",,4,,"Final performance reporting remains undone, so it's not complete.",,,,,,1500_questions.txt
785,"To ensure stakeholders get meaningful progress data, blending their info
needs with value analysis, where do you document this?",Communications register,Stakeholder register,Stakeholder management plan,Communications management plan,,4,,The communications management plan tailors info to stakeholder needs.,,,,,,1500_questions.txt
786,"To cut delays from misunderstandings in a cross-cultural team, what
should the project manager prioritize next?",Host a workshop.,Form a focus group.,Specify communication content.,Consult external stakeholders.,,3,,Defining what's communicated reduces confusion upfront.,,,,,,1500_questions.txt
787,"An external resource flags an expiring contract. Which document should
the project manager check?",Organizational process assets,Project contract,Organization chart,Resource management plan,,2,,The contract holds the expiration details.,,,,,,1500_questions.txt
788,"Which tools and techniques---decomposition, rolling wave planning, and
templates---belong to what process?",Define Activities,Estimate Activity Durations,Develop Schedule,Sequence Activities,,1,,These aid in breaking down and defining activities.,,,,,,1500_questions.txt
789,"With a sponsor's high-level vision for a product due in three months at
a trade show, what scheduling technique fits best?","Iterate work for an overview, refining details over time.","Use temporary tasks to show leads and lags, adjusting later.",Baseline the schedule and lock scope.,Run Monte Carlo for a date range with vague requirements.,,1,,Iterative scheduling adapts to evolving needs.,,,,,,1500_questions.txt
790,"Stakeholders disagree on a scope change approval. What tool should the
project manager use?",Affinity diagram,Multicriteria decision analysis,Autocratic decision making,Alternatives analysis,,2,,Multicriteria analysis weighs options objectively.,,,,,,1500_questions.txt
791,Who decides mandatory dependencies in Sequence Activities?,Project manager,External stakeholders,Internal stakeholders,Project team,,4,,The team identifies critical dependencies.,,,,,,1500_questions.txt
792,"A stakeholder satisfaction survey gets few responses. How should the
project manager boost input?",Share a lessons learned report for feedback.,Extend the deadline with a reward incentive.,Use interviews and feedback meetings.,Log the issue and escalate to seniors.,,3,,Direct engagement like interviews yields better responses.,,,,,,1500_questions.txt
793,"A stakeholder notes Project B might launch before Project A's execution,
easing A's workload. What should the project manager do?",Log it as a threat in the risk register.,Request Project B's critical path.,Adjust Project A's scope.,Record it as an opportunity in the risk register.,,4,,It's a beneficial opportunity to leverage.,,,,,,1500_questions.txt
794,"In Define Activities, how does the schedule management plan function?",Logs lessons from past projects.,Holds the standard activity list.,Supports change request documentation.,Sets the detail level for work management.,,4,,It guides the granularity of activity definition.,,,,,,1500_questions.txt
795,What boosts the odds of success for a multidisciplinary project team?,Problem-solving focus,Sensitivity to top management's political needs,Emphasis on individual tasks,Customer demand orientation,,1,,"Problem-oriented teams adapt and solve issues effectively, enhancing
project outcomes.",,,,,,1500_questions.txt
796,"Which strategy addresses risks with potential negative impacts on
project goals?",Exploit,Share,Enhance,Transfer,,4,,"Transfer shifts negative risk to another party, like insurance.",,,,,,1500_questions.txt
797,"When securing procurements, which process ensures stakeholder consensus?",Update Stakeholder Engagement Plan,Manage Stakeholder Engagement,Monitor and Control Project Work,Plan Procurement Management,,4,,Plan Procurement Management aligns stakeholders on procurement terms.,,,,,,1500_questions.txt
798,"Your cost control expert has crafted a budget for adding a second
surgical center to Children's Hospital. Cash flow peaks in closure,
unlike most projects where spending spikes during which phase?",Initiating,Monitoring and Controlling,Controlling,Executing,,4,,Executing typically consumes the most resources as work is performed.,,,,,,1500_questions.txt
799,"A stakeholder requests pilot technology in the scope management plan for
marketing. What should the project manager do?",Tap project reserves for the tech.,Boost the budget for the addition.,Include the stakeholder in scope planning.,Review the scope baseline with them.,,4,,Reviewing the baseline clarifies expectations and assesses feasibility.,,,,,,1500_questions.txt
800,Team completion and staff release occur in which Tuckman stage?,Adjourning,Concluding,Releasing,Closing,,1,,"Adjourning marks the end, where teams disband.",,,,,,1500_questions.txt
801,"To adopt Agile and shift culture, what conditions must the new
environment meet? (Select two.)",Transparent environment,"Safe, honest workplace",Checks and balances,Flexible setting,,,"1,2","A safe, transparent culture supports Agile adoption.",,,,,,1500_questions.txt
802,When does Monitor and Control Risks happen?,At project kickoff,During performance analysis,Throughout the project,At milestones,,3,,Risk monitoring is ongoing across the project lifecycle.,,,,,,1500_questions.txt
803,"A construction project manager can't visit daily due to other duties.
The client, seeking updates from the team, feels progress is off-track.
What's the best action?",Review the communications plan with the client.,Assign an inspector as the sole client contact.,Add a client channel to the communications plan.,Increase status meeting frequency with the client.,,3,,Updating the plan ensures consistent client communication.,,,,,,1500_questions.txt
804,"An audit reveals a team member's quality concern not covered by metrics
in the quality plan. What should the project manager do?",Justify the standard metrics to the team member.,Log the feedback in the issue log for analysis.,Meet with the sponsor and team member on quality.,Assess the feedback and propose a change if needed.,,4,,Analyzing feedback and initiating a change ensures quality alignment.,,,,,,1500_questions.txt
805,Which input is essential for creating the WBS?,Project Quality Plan,Project Schedule Network,Project Management Software,Project Scope Management Plan,,4,,The scope management plan guides WBS development.,,,,,,1500_questions.txt
806,"Hector's team debates minor decisions, draining productivity. What can
he use for collective decision-making?",\* Fist-of-five voting,\* Bare fist fighting,\* Planning poker,\* Brainstorming,,1,,Fist-of-five voting streamlines team consensus.,,,,,,1500_questions.txt
807,"A project manager joins a global communications equipment rollout with
multi-country partners. How should they prep for the kickoff to shape
implementation?","Meet partners to align on assumptions, constraints, and regulations.",Draft assumptions and constraints with the team for compliance.,Direct partners to outline their tasks and needs.,Build a risk register for high-risk areas and mitigation.,,1,,Early alignment with partners sets a unified foundation.,,,,,,1500_questions.txt
808,"On your agile telecom project, you share extensive data, like change
requests and activity dates, with the team. This data is best described
as?",Key performance indicators,Work performance reports,Work performance data,Work performance information,,3,,Raw observations like these are work performance data.,,,,,,1500_questions.txt
809,"Daily face-to-face talks are vital for project success, beyond emails.
As lead PM, you set a brief daily meeting with key players. What's it
called?",\* Daily standups,\* Daily review,\* Planning and collaboration,\* Steering group,,1,,"Daily standups, typically 15 minutes, align agile teams.",,,,,,1500_questions.txt
810,"Jenny at Berry Corporation plans a program of projects, using past
efforts to estimate costs for similar new ones. What estimating method
is she using?",\* Bottom-up,\* Top-down,\* Parametric,\* Triangular,,2,,Top-down leverages historical analogs for cost prediction.,,,,,,1500_questions.txt
811,Select three core success factors for forming Agile teams.,Building a safe working environment,Building foundational trust,Building an Agile mindset,Building a strong network,,,"1,2,3","Safety, trust, and mindset underpin Agile team success.",,,,,,1500_questions.txt
812,"Stephanie's team mandates a detailed user story manual for agile
projects. This is most likely a what?",\* None of the above,\* Embellishment,\* Corporate requirement,\* Team-driven need,,2,,An embellishment adds low-value overhead to agile norms.,,,,,,1500_questions.txt
813,"Yang, on a mobile device project, reprioritizes the backlog, tracks
velocity, adjusts plans, and holds retrospectives every three weeks.
What process is he performing?",\* Control Schedule,\* Control Scope,\* Manage Stakeholder Engagement,\* Estimate Activity Resources,,1,,These actions align with controlling the schedule in scrum.,,,,,,1500_questions.txt
814,"A project's EV report shows a CV of -5,000 and an SV of 1,000. What's
the activity's status?",Behind schedule and over budget,On schedule and within budget,Behind schedule and within budget,Ahead of schedule and over budget,,4,,Positive SV means ahead; negative CV means over budget.,,,,,,1500_questions.txt
815,"Tina, a veteran PM at Hat Corporation, is asked by Sam to aid with a
stakeholder feeling ignored. What's her best advice?",\* Escalate to the PMO.,\* Meet the stakeholder to uncover their concerns.,\* Refer them to me for questions.,\* Schedule follow-ups with them.,,2,,Direct engagement resolves the root issue effectively.,,,,,,1500_questions.txt
816,"Shane manages a flat startup where authority is resisted, and all claim
sponsorship. Decisions stall without a tiebreaker. He sets a two-week
decision rule with defaults or votes. What expert judgment aspect is
this?",\* Requirements management,\* Communication strategies,\* Organizational culture,\* Analytical techniques,,3,,Adapting to the culture shapes effective ground rules.,,,,,,1500_questions.txt
817,"Joaquin's government website crashed post-launch from overload,
stabilized after a week, and he held a retrospective logged on a wiki.
What governance element is this?",\* Defining roles,\* Phase reviews,\* Capturing lessons learned,\* Risk escalation,,3,,Lessons learned preserve insights for future use.,,,,,,1500_questions.txt
818,"As a PMP candidate, you note project selection methods. Constrained
optimization is specialized. Which is an example?",\* Linear programming,\* Net present value,\* Benefit/cost ratios,\* Future value,,1,,Linear programming is a mathematical optimization technique.,,,,,,1500_questions.txt
819,"Abbas, on the Jefferson Project, must document technical direction and
changes for a new app. What meets management's need?",\* Change management plan,\* Scope control,\* Configuration management,\* Integrated change control,,3,,Configuration management tracks product traits and updates.,,,,,,1500_questions.txt
