id,statement,option1,option2,option3,option4,option5,correct_answer,correct_answers,explanation,erro_alternative1,erro_alternative2,erro_alternative3,erro_alternative4,erro_alternative5,source
1092,"For a virtual team with 12 local members, 4 West Coast, 2 Kansas City,
and 6 London staff---some on odd shifts---what tracks their availability
and skills?",Resource timeline,Activity timeline,Team list,Project timeline,,1,,"Resource timelines, from the Acquire Resources process, detail
availability and capabilities.",,,,,,1500_questions.txt
1093,"You're mentoring a new project manager who mentions a senior engineer
disrupting meetings and breaking rules. What's your top advice?",Tackle the rule-breaking with the engineer first.,Trust their instincts to handle it.,Escalate to the engineer's boss right away.,Bend rules for this key resource.,,1,,"Addressing the engineer directly fosters respect for rules and uncovers
causes, before escalating if needed.",,,,,,1500_questions.txt
1094,"As a project manager, you use empathic listening to grasp others'
viewpoints. How should you proceed?",Echo their message's content,"Question, then judge the content","Judge the content, then advise",Restate their words and mirror their emotions,,4,,"Empathic listening seeks to understand without judgment, rephrasing and
reflecting feelings.",,,,,,1500_questions.txt
1095,"Your leveled schedule, set due to scarce resources, now faces a rush
mandate. How do you adjust it?",Resource tweaking,Reverse resource planning,Critical chain method,Resource reshuffling,,4,,"Reshuffling resources can shorten a leveled schedule by shifting
non-critical to critical tasks.",,,,,,1500_questions.txt
1096,An issue log feeds into which Human Resource Management process?,Oversee Project Team,Gather Project Team,Plan Human Resources,Build Project Team,,1,,,,,,,,1500_questions.txt
1097,"In a weak matrix as project manager, you've finished the schedule and
need approval to assign resources. Who approves it?",\* Functional supervisors,\* Project advocates,\* No one; I have full control here,\* Team members,,1,,"In a weak matrix, functional supervisors hold sway and must approve the
schedule.",,,,,,1500_questions.txt
1098,"See the PERT table. Stakeholders want a 95.44% confidence level for
Activity 2's duration. How long will it take?",Between 21 and 25 days,Between 23 and 28 days,Between 18 and 28 days,Between 13 and 33 days,,3,,"With a standard deviation of 1.67 \[(30-20)/6\], 95.44% confidence (3
deviations) is 5.01 days. Expected value is 23, so 18-28 days.",,,,,,1500_questions.txt
1099,"A multiphase network project's Phase 1 ends next month, but Phase 2's
budget approval lags. The project manager has a plan. What tracks this
to avoid performance hits?",Issue tracker,Action tracker,Assumption tracker,Change tracker,,3,,,,,,,,1500_questions.txt
1100,"Your new manager, sponsoring your project post-reorg, wants a timeline
of value-adding outcomes. What's this?",Benefits,Milestones,Net present value,Internal rate of return,,1,,"Benefits, per the PMBOK® Guide, are valuable outcomes for the sponsor
and beneficiaries.",,,,,,1500_questions.txt
1101,Name three traits servant leaders often show.,Guiding,Aiding team growth,Boosting self-awareness,Directing for clarity,,,"1,2,3","Servant leaders guide, aid growth, and boost awareness, fostering
collaboration and value.",,,,,,1500_questions.txt
1102,"Thomas excels at foreseeing project issues but struggles as a leader,
upset by missed details. How can he improve?","\* Quit, as leadership can't be learned.",\* Boost emotional intelligence for better leadership.,\* Demand a new team that gets his methods.,\* Train his team to catch details.,,2,,"Enhancing emotional intelligence helps Thomas manage emotions, easing
team tension and boosting leadership.",,,,,,1500_questions.txt
1103,"Your team adopts agile per the division president's order at a
healthcare device firm. What power type is this?",Legitimate,Referent,Expert,Punishment,,1,,"Legitimate power stems from the president's formal role driving this
shift.",,,,,,1500_questions.txt
1104,"John's project aims to transform mobile fitness tracking. He'll define
deliverables early, refining them later. What life cycle is this?",Iterative,Predictive,Incremental,Hybrid,,1,,"Iterative defines deliverables early, refining as it goes---John's
approach.",,,,,,1500_questions.txt
1105,"The sponsor learns the CEO promised stockholders your project ends this
year, six months early, with budget as the main limit. How do you speed
it up?",Check the plan for fast-track options and revise the timeline.,Add resources to hasten work.,Seek more funds to outsource a phase.,Push the sponsor to correct the CEO's claim.,,1,,"Fast-tracking compresses phases within the budget constraint, the best
fix here.",,,,,,1500_questions.txt
1106,"Heath, scrum master for Project K in its first sprint, sees tasks
failing quality checks. What's his next step?",\* Find training to boost team quality skills.,\* Run a Monte Carlo simulation.,\* Do a gap analysis.,\* Report to the product owner.,,1,,Training addresses skill gaps to fix quality issues early.,,,,,,1500_questions.txt
1107,Which procurement process awards a contract?,Manage Procurements,Finalize Procurements,Execute Procurements,Plan Procurements,,3,,,,,,,,1500_questions.txt
1108,"Zane, scrum master for Project F, nine sprints in with 73 story points
and \$15,000 under budget, finds deployed features non-compliant
legally. What's next?",\* Notify the steering committee.,\* Task a team member with mitigation research.,\* Add correction stories to the next sprint.,\* Call the legal team.,,1,,"Alerting the steering committee aligns strategy for the noncompliance
issue.",,,,,,1500_questions.txt
1109,"Dee-dee manages a bauxite mine project in Australia that hit its ore
goal, deeming it successful in her stakeholder report. What data guides
this closure?",\* Quality targets,\* Cost targets,\* Success criteria,\* Project overview,,3,,"Success criteria define what makes the project a win, like hitting the
ore goal.",,,,,,1500_questions.txt
1110,"Jean calls a team meeting to solve a tough issue, knowing some resist
and support varies. She wants open reservations. What model fits best?",\* Fist-of-Five Voting,\* Participatory Decision Game,\* Highsmith's Decision Spectrum,\* Basic Voting,,3,,"Highsmith's Decision Spectrum captures a range of views and
reservations.",,,,,,1500_questions.txt
1111,What best captures honesty for project managers?,Owning our choices and their outcomes,Seeking truth and acting truthfully,Deciding fairly and objectively,"Valuing ourselves, others, and resources",,2,,"Honesty means grasping truth and reflecting it in words and deeds, per
the Code of Ethics.",,,,,,1500_questions.txt
1112,"For a multi-site project with many risks, what's the best risk-handling
method?",\* Assign risk owners for each risk.,\* Insure every risk.,\* Visit sites as risks near.,\* Schedule risks to avoid overlap.,,1,,Risk owners track and manage risks effectively across sites.,,,,,,1500_questions.txt
1113,"Hunter, managing procurements without a dedicated department, opts to
outsource a service, picking one contractor by their action plan. What
bid document fits?",\* Invitation to negotiate,\* Price quote request,\* Proposal request,\* Info request,,3,,"A proposal request seeks action plans, matching Hunter's needs.",,,,,,1500_questions.txt
1114,"A project nears delivery when the manager spots a missed regulatory
need. What should've been done?",Run a SWOT analysis,Update the risk log,Analyze documents,Verify regulatory traceability,,4,,,,,,,,1500_questions.txt
1115,"Larry manages Project X and has new team member Kathy. He's tied up with
a steering committee presentation and can't introduce her for two weeks.
What's next?",\* Have Kathy post a greeting online.,\* Tell Kathy to meet everyone herself.,\* Pair Kathy with a teammate for intros.,\* Wait to introduce her at the next meeting.,,3,,Pairing Kathy with a teammate builds connections and support.,,,,,,1500_questions.txt
1116,"Randy, a developer using Test-Driven Development, seeks a tool to sync
with remote teammates and avoid build breaks. What's best?",\* A CASE tool,\* An automated tester,\* A smart board,\* Kanban board,,2,,"Automated testers run unit tests in builds, ensuring stability.",,,,,,1500_questions.txt
1117,"A big risk triggers, and the plan is executed. What's the project
manager's next move?",Revise the risk plan.,Adjust schedule and budget.,Update lessons learned.,Spot new risks and watch residuals.,,3,,,,,,,,1500_questions.txt
1118,Stakeholder conflicts often sink projects. What's the usual cause?,Clashing goals,Personal biases,Diverse backgrounds,Varied temperaments,,1,,"Clashing goals spark conflict, requiring the manager to align interests.",,,,,,1500_questions.txt
1119,"Leo, scrum master for Project Trout, eight sprints in, faces stakeholder
panic over a rival's similar product. What's his best step?",\* Evaluate the rival product and adjust with stakeholders.,\* Scrap the project for a new one.,\* Add features next sprint.,\* Reprioritize the backlog for uniqueness.,,1,,"Assessing the rival and adjusting with stakeholders keeps the project
competitive.",,,,,,1500_questions.txt
1120,"An activity starts early on the 10th, late on the 19th, and lasts four
days with no breaks. What's true?",Total float is nine days.,Early finish is end of the 14th.,Late finish is the 25th.,It could finish in two days with double resources.,,1,,"Float is 9 (19-10). Early finish is the 13th, late is the 22nd; resource
impact lacks data.",,,,,,1500_questions.txt
1121,"At Galaxy Communications using XP, how can Anthony best show respect?",\* Review Lisa's code same-day.,\* Avoid gossiping about Lisa's unique code.,\* Praise Lisa's work despite her approach.,\* Stick to team standards in reviews.,,3,,Praising Lisa's work despite differences shows XP's respect value.,,,,,,1500_questions.txt
1122,"Russell leads an agile team spread across multiple states, with members
unfamiliar with one another due to limited in-person contact. To shift
this team from the Norming to the Storming phase, Russell could",\* Increase sprint points in upcoming cycles to ramp up the challenge.,\* Arrange a workshop on team development stages.,\* Encourage each member to tackle a tough user story per sprint.,"\* Partner with the product owner to weave in complex tasks early,
sparking team collaboration.",,4,,"The strongest choice is sparking collaboration with complex tasks early.
Boosting sprint points doesn't directly tie to team maturity. Training
on team stages won't accelerate the shift. Volunteer requests clash with
self-organizing team norms.",,,,,,1500_questions.txt
1123,"You're overseeing a project to craft a mobile app that alerts users to
stay indoors when UV rays reach hazardous levels. In a team huddle, the
value of recording both explicit and tacit knowledge is heavily
emphasized. What defines tacit knowledge?","Knowledge easily documented with words, visuals, or figures","Knowledge tricky to pin down or convey, like beliefs, experiences, and
practical know-how",Technical insights logged from prior team projects,Standardized expertise outlined by recognized industry bodies,,2,,"Knowledge splits into explicit and tacit forms. Explicit is readily
captured via words, images, or numbers; tacit involves abstract, elusive
elements like beliefs, experiences, and hands-on skills.",,,,,,1500_questions.txt
1124,"Your project is humming along on schedule when a new regulatory mandate
alters a performance spec. To weave this shift into the project
management plan, you should",Convene the change control board.,"Revamp the WBS, timeline, and plan to match the new rule.",Draft a change request.,Alert all impacted parties of the revised approach immediately.,,3,,"A change request captures the shift's details and impact, feeding into
the integrated change control process. It ensures a documented trail and
approval, guarding against later disputes.",,,,,,1500_questions.txt
1125,"A team spots a chance to boost software without denting budget or
timeline. They implement it sans proper records, triggering production
hiccups later. What process could have dodged this?",Schedule oversight,Qualitative risk review,Scope planning,Integrated change management,,4,,,,,,,,1500_questions.txt
1126,"A project manager collaborates with the team to pinpoint lessons
learned, later archiving them and summing them up in the final report.
What's this task called?",Wrapping up administratively,Updating the lessons learned log,Holding a team briefing,Gathering performance data,,1,,"This ties to administrative closure, which includes archiving and final
reporting beyond just updating the lessons log.",,,,,,1500_questions.txt
1127,"At a pharma firm, the project manager emails an apology to a subordinate
for cutting their last chat short. What communication style is this?",Written,Formal written,Casual written,Informal electronic,,3,,"Emails can be formal or informal based on tone. Here, the apology
suggests a casual written exchange, not a stiff formal note.",,,,,,1500_questions.txt
1128,"A new project involves stakeholders from various units, but some can't
join a process walkthrough. The project owner pushes to proceed anyway
for their own goals. What's the project manager's best move?",Push the meeting to include everyone.,Host a separate session for the absent stakeholders.,Run the meeting without all stakeholders for initial needs.,Chat with the sponsor about stakeholder schedules.,,4,,,,,,,,1500_questions.txt
1129,"Based on this data, is the project ahead or behind its planned pace? EV
= 95, PV = 85, AC = 100.","Ahead, since the variance is positive.","Ahead, since the variance is negative.","Behind, since the variance is negative.","Behind, since the variance is positive.",,1,,"Schedule variance (EV - PV) is 95 - 85 = 10, a positive result, meaning
the project's ahead of plan.",,,,,,1500_questions.txt
1130,"Cost management processes and their tools are typically picked during
which phase?",Financial oversight,Cost forecasting,Life cycle setup,Plan crafting,,3,,,,,,,,1500_questions.txt
1131,"Emma's crew aims to keep stakeholders engaged and align team
expectations per iteration. Her best tactic is to",\* Have all stakeholders rank the backlog.,\* Ensure regular chats on the \'done\' definition.,\* Invite stakeholders to daily standups.,\* Mandate stakeholder presence at the charter reading.,,2,,"Regularly defining \'done\' aligns expectations efficiently.
Stakeholder-heavy backlog ranking or constant meeting invites
overcomplicate things, and charter reviews don't shape iteration goals.",,,,,,1500_questions.txt
1132,"What's the monthly scrum master meeting that reviews sprint wins, flops,
and next-step commitments called?",Stand-up,Sprint planning,Sprint review,Sprint retrospective,,4,,"A sprint retrospective refines processes by reflecting on what worked,
what didn't, and what to tweak next.",,,,,,1500_questions.txt
1133,"Yolanda, scrum master for Project F in its ninth iteration, faces a new
developer's query during a retrospective about her focus on team
support. What's her likely reply?",\* Scrum masters have little else to do.,\* She's watching the team closely due to distrust.,\* Prepping the team for success is servant leadership.,\* Her bonus hinges on Project F's outcome.,,3,,"Servant leadership means clearing hurdles so the team thrives. Yolanda's
efforts reflect this, not idle time, distrust, or bonus-chasing.",,,,,,1500_questions.txt
1134,"Christian drafts acceptance tests and demos products at sprint reviews.
His role is likely",\* Team lead,\* Business rep,\* Delivery crew,\* Project overseer,,3,,"Writing tests and demoing fit the delivery crew, not business reps or
project overseers in agile setups.",,,,,,1500_questions.txt
1135,"At an agriculture firm stuck on old-school field fertilizing, the CEO
greenlights tech upgrades after seeing rivals thrive. What methodology
fits best?",\* Hybrid,\* Predictive/plan-driven,\* Iterative,\* Incremental,,1,,"Hybrid suits partial tech shifts with hesitant stakeholders, unlike
rigid predictive or scope-flexible iterative/incremental approaches.",,,,,,1500_questions.txt
1136,Which links tasks to the team members handling them?,Work breakdown structure (WBS),Network diagrams,Staffing plan,Responsibility assignment matrix (RAM),,4,,,,,,,,1500_questions.txt
1137,What tools or techniques aid the Close Project or Phase process?,Reserve analysis and expert input,Facilitation methods and gatherings,Expert input and data analysis,Performance checks and meetings,,3,,,,,,,,1500_questions.txt
1138,"You're managing a seven-month project to install tricky energy-saving
fixtures. Post-training, your team's checklist ensures quality. EVM
shows CPI at 1.09 and SPI at 0.6. What's your next step?",\* Sit tight; you're under budget and ahead.,\* Give the team a break since you're ahead.,\* Propose extra hands to hasten progress.,\* Cut contractors since you're over budget.,,3,,"CPI \> 1 means under budget, but SPI \< 1 signals a lag. Extra labor
could speed things up using spare funds.",,,,,,1500_questions.txt
1139,"After analyzing data, a project manager pinpoints variance from the
approved scope. What's the next move?",Tweak the scope management plan.,Adjust the scope baseline.,Assess if corrective or preventive steps are needed.,Shift the performance baseline.,,3,,,,,,,,1500_questions.txt
1140,"During execution, team disputes push the project over budget and off
schedule. The manager communicates subjectively, ignoring input and
resisting a learning platform. What method are they using?",Pull,Independent,Interactive,Push,,1,,,,,,,,1500_questions.txt
1141,"A consultancy is tapped to build a supply chain app for a beverage
maker. In a client meeting, they flag a budget issue. Where did the
project manager spot this?",Project exclusions,Project assumptions,Project deliverables,Project constraints,,2,,,,,,,,1500_questions.txt
1142,"John, VP of customer ops and sponsor of Project A, meets Sue, the
project manager, to tackle a ballooning budget. What's typically the
biggest project cost driver?",Resources,Vendors,Materials,Travel,,1,,"Resources---human, material, and supplies---usually dominate project
expenses.",,,,,,1500_questions.txt
1143,"While shaping a project management training curriculum, you join PMI® to
align with best practices. Volunteering for their Scope Statement
standard, now released, prompts what action?",Boosting your PM skills,Issuing a corrective tweak,Taking preventive steps,Updating your plan pronto,,2,,"Post-release, aligning with the new standard via a corrective change
request keeps your project on PMI®'s track.",,,,,,1500_questions.txt
1144,"Bethany oversees a big equipment install in Mexico, using an interpreter
to bridge her Spanish gap. To empower and connect with key stakeholders,
which document guides her on communication needs?",\* RACI Chart,\* Stakeholder management plan,\* Stakeholder register,\* Stakeholder engagement matrix,,2,,"The stakeholder management plan details communication needs, unlike the
register's basic list or the matrix's engagement focus.",,,,,,1500_questions.txt
1145,"Martha manages Project THQ, five weeks in, on budget and a week ahead. A
developer finishes a key task needing government compliance. What's her
next step?",\* Check the deliverable for accuracy.,\* Assign a teammate to review it.,\* Do nothing; it's done.,\* Ask the developer to recheck.,,1,,"Martha should verify the deliverable herself to ensure compliance,
avoiding risks of inaction or delegation.",,,,,,1500_questions.txt
1146,"A plant project's ready for handover, but the maintenance manager flags
noncompliance with standards. What should've been done?",Lean on expert advice.,File a change request.,Map stakeholder needs.,Update the comms plan.,,3,,,,,,,,1500_questions.txt
1147,"A team's cutting-edge prototype flops in testing against specs. What's
the project manager's move?",Seek a deviation from the CCB.,Dig into the root cause.,Haggle specs with the sponsor.,Notify the sponsor and fix it.,,2,,,,,,,,1500_questions.txt
1148,What best sums up stakeholders?,Team members executing the plan,Anyone impacted by or perceiving impact from project choices,The lead tasked with hitting goals,Resource providers accountable for success,,2,,"Per PMBOK® 6th, stakeholders are those affecting or affected by project
decisions.",,,,,,1500_questions.txt
1149,Blending Theory Y and Hygiene Theory yields what motivational framework?,Recognition and Rewards,Situational Leadership,Tannenbaum and Schmidt,Contingency,,4,,"Contingency Theory merges Theory Y's optimism with Hygiene's drive for
competency.",,,,,,1500_questions.txt
1150,"A project manager inherits a two-year strategic effort spanning
continents, with tricky multilingual, time-zone communication. For team
roles and work locations, which document helps?",Business environment factors,Activity details,Comms plan,Work breakdown structure (WBS),,4,,,,,,,,1500_questions.txt
1151,"Sue, head of an enterprise PMO, presents her role at the annual meeting,
stressing alignment of projects with strategic goals. What's she
outlining?",Organizational project management,Business oversight,PMI Talent Triangle™,Portfolio management,,1,,"OPM integrates portfolio, program, and project efforts with strategic
aims, per PMBOK®.",,,,,,1500_questions.txt
1152,"A firm with a big PMO launches a mentorship program to grow talent.
Enthusiasm's high, but loose structure sparks issues---like a team
member overwhelmed by a program manager's off-target mentoring. How to
fix it?",\* Scrap it; it's poorly planned.,\* Pair mentors and mentees by goals.,\* Do nothing; she should be grateful.,\* Randomize pairings.,,2,,Matching goals beats scrapping a promising idea or ignoring mismatches.,,,,,,1500_questions.txt
1153,"As an agile team lead, Bianca ropes everyone into problem-solving. What
signal does this send?",\* Team members can step beyond their roles.,\* She's clueless on the fix.,\* She doubts business partners' answers.,\* She distrusts one member's idea.,,1,,"Involving all shows trust in their broader contributions, a hallmark of
agile teamwork.",,,,,,1500_questions.txt
1154,"Ideally, a project manager would craft cost estimates",Pre-budget finalization,Post-budget approval,Via parametric models tailored to the project,With bottom-up techniques,,1,,"Estimates should precede budget completion for accuracy, though often
they follow approval.",,,,,,1500_questions.txt
1155,What's an example of push communication?,Intranet portals,Video calls,Knowledge hubs,Press releases,,4,,,,,,,,1500_questions.txt
1156,"At Lightning Bolt Enterprises, you're researching a new rechargeable
battery. A stakeholder's approved change request tweaks the product
scope. Pick three true statements.","The product scope description, part of the charter, shapes project
scope.",The project scope statement guides team work and future calls.,Product analysis turns descriptions into deliverables.,Change requests outside the original scope should be nixed.,,,"2,3,4","The scope statement, not just the charter, drives work; analysis refines
deliverables; and off-scope changes face rejection.",,,,,,1500_questions.txt
1157,"Nancy, a seasoned systems engineer, takes on her first PM role due to
her knack for leadership. She falters, missing a milestone and
overshooting budget by \$20,000. What PMI Talent Triangle™ piece is she
missing?",Schedule mastery,Technical PM skills,Leadership,Strategic insight,,2,,"Her technical PM gap---not leadership or strategy---trips her up on
budget and timeline.",,,,,,1500_questions.txt
1158,Choose two true statements about lateral thinking.,It's tackling problems from fresh angles.,It's parallel analysis.,Edward de Bono coined and studied it.,It's a risk identification tool.,,,"1,3","Lateral thinking, per de Bono, reframes problems uniquely, aiding scope
via alternative analysis.",,,,,,1500_questions.txt
1159,"Deidra joins a software project mid-execution with an unclear
methodology. A developer resists documenting requirements, citing
slowdowns. How should she secure docs while building rapport?",\* Mandate a backlog for tracking.,\* Find common ground on doc needs.,\* Sidestep the issue entirely.,\* Team up to define doc levels.,,4,,"Collaboration balances doc needs with team harmony, fostering a win-win.",,,,,,1500_questions.txt
1160,"Yulonda's gathering requirements for her scope plan, tapping lessons
from a peer's 20 similar projects. What data technique is this?",\* Interviews,\* Benchmarking,\* Surveys,\* Brainstorming,,2,,"Benchmarking leverages past projects for best practices and performance
baselines.",,,,,,1500_questions.txt
1161,"Mid-project, the manager sees stakeholders' delivery hopes diverging
from the plan. What could've prevented this?","Set acceptance criteria, assumptions, and requirements docs.",Reviewed expectations with the sponsor.,Built a traceability matrix.,Kept a risk log for scope creep.,,1,,,,,,,,1500_questions.txt
1162,"Stakeholders OK the business case with past lessons, but new laws shift
regs. What should the PM use to fix this?",Data crunching and SOW,Facilitation and business factors,Facilitation and charter,Alternatives and process assets,,4,,,,,,,,1500_questions.txt
1163,"Halfway through a software design phase, the PM sees tasks slipping.
What's the first step?",Email stakeholders the delay and update the plan.,Note the lag for the next meeting.,Adjust task dates in the plan.,Log the issue.,,1,,,,,,,,1500_questions.txt
1164,"In a change control meeting, you review a request to double scope with
little benefit gain. The submitter, a bigwig, often gets bloated changes
approved. What power type is this?",Referent,Expert,Punishment,Legitimate,,4,,"Their position fuels legitimate power, swaying approvals.",,,,,,1500_questions.txt
