id,statement,option1,option2,option3,option4,option5,correct_answer,correct_answers,explanation,erro_alternative1,erro_alternative2,erro_alternative3,erro_alternative4,erro_alternative5,source
1,"At a project meeting, a stakeholder challenges a critical deliverable
and milestone outlined in the approved charter. What could the project
manager have done to avoid this conflict?",Involved the stakeholder from the outset,Mapped stakeholders with a power/interest grid,Held regular check-ins with the stakeholder,Performed an in-depth stakeholder analysis,,4,,"A detailed stakeholder analysis during initiation could have identified
concerns early, preventing misalignment on deliverables and milestones.",,,,,,1500_questions.txt
2,Who developed the model outlining the phases of team development?,Abraham Maslow,Dr. Bruce Tuckman,Victor Vroom,David McClelland,,2,,"The Tuckman ladder, detailing team development stages, was created by
Dr. Bruce Tuckman.",,,,,,1500_questions.txt
3,"You're leading a project for Community Trends, a nonprofit addressing
social needs. After calculating performance metrics, you get: BAC = 900,
ETC = 65, PV = 500, EV = 475, AC = 425. What's true about this project?",It's ahead of schedule with higher-than-expected costs,It's lagging behind schedule but under budget,It's behind schedule with elevated costs,It's on track schedule-wise and under budget,,2,,"With SV = -25 (EV - PV), it's behind schedule. CV = 50 (EV - AC) shows
costs are lower than planned.",,,,,,1500_questions.txt
4,"While drafting the project scope with the sponsor, they raise safety
worries about electrical requirements. How should these concerns be
categorized?",Assumption,Product requirement,Pure risk,Cost of quality,,3,,"The electrical safety issue is a pure risk---potentially harmful with no
upside, unlike business risks with possible gains.",,,,,,1500_questions.txt
5,At what project stage is success most likely?,Execution,Closure,Initiation,Planning,,2,,"Closure signals successful completion, making it the most likely stage
for success.",,,,,,1500_questions.txt
6,"Hank, scrum master for Project E, is five sprints in with a 64-point
velocity. During a sprint review, two stakeholder groups clash over
deliverable priority. What should Hank do?",Convene both groups to decide delivery order,Prioritize the more influential stakeholder,Favor the stakeholder with greater authority,Let the team vote on it,,1,,"Collaborating with stakeholders to agree on priority, then documenting
it, fosters consensus over arbitrary favoritism.",,,,,,1500_questions.txt
7,"In a status meeting, a team member flags a sudden price hike for a vital
component. What's the project manager's next move?",Assess the price surge's project impact,Check the procurement management plan,Adjust the risk plan for this change,Add the cost to the budget,,1,,"Analyzing the impact first informs subsequent actions like budget or
risk adjustments.",,,,,,1500_questions.txt
8,"A project, on budget and on time at week 10 of 20, faces a sponsor
request via senior management to finish two weeks early. What's the best
first step?",Record the change request,Fast-track the schedule,Discuss with the sponsor,Crash the project,,1,,"Documenting the change request initiates integrated change control,
capturing details before other steps like crashing or consulting.",,,,,,1500_questions.txt
9,What's an input to the Close Project or Phase process?,Accepted deliverables,Final products or services,Document updates,Work performance info,,1,,Accepted deliverables are key inputs to formal closure.,,,,,,1500_questions.txt
10,"Company A hires a PM for Company B's project. What document from Company
B is essential for the charter?",Scope statement,Statement of work (SOW),Work breakdown structure (WBS),Project management plan,,2,,"The SOW provides the project's purpose and scope, foundational for the
charter.",,,,,,1500_questions.txt
11,"Wally manages Project Verify, a security software rollout, eight weeks
in. A triggered risk delays it by three weeks and adds \$15,000 in costs
by pausing tasks for fixes. What risk response is this?",Transference,Escalation,Mitigation,Fast-tracking,,3,,"Mitigation reduces risk impact, here by pausing activities to address
the issue, costing time and money.",,,,,,1500_questions.txt
12,"As HR manager at a phone company with a flawed feedback system, you aim
to reward customer service reps with KPIs. What's the best goal?",Improve the feedback system,Gain more customers for profit,Reduce connectivity issues,Boost phone sales,,1,,"Enhancing the feedback system directly tackles the core issue, unlike
the other options.",,,,,,1500_questions.txt
13,Select two ways servant leadership empowers teams.,Boosts team accountability,Offers mentoring and support,Relies on one clear leader,Uses autocratic decisions,,,"1,2","Servant leadership fosters self-management through accountability and
support, not top-down control.",,,,,,1500_questions.txt
14,"Syd negotiates with another team needing a development environment for
quality control. They'll maintain it if Syd's team consults an hour
weekly. What negotiation stage is this?",Acceptance,Terms negotiation,Exploration,Closure,,2,,"This is terms negotiation---offers are made and options explored before
final agreement.",,,,,,1500_questions.txt
15,"George, scrum master for Project X (ninth iteration, \$150,000 budget,
96 velocity), sees a junior developer struggling. What's his best
action?",Let the team self-manage,Send them to training,Pair them with a senior developer,Report to their manager,,3,,"Pairing with a senior developer builds skills and team bonds
efficiently.",,,,,,1500_questions.txt
16,"You're managing a high-stakes project needing full resource control.
What organizational structure fits best?",Strong matrix,Projectized,Project coordinator,Weak matrix,,2,,A projectized structure gives the PM complete authority over resources.,,,,,,1500_questions.txt
17,"Samah pushes to hire contractors to aid her team, but it doesn't always
work due to training needs. A stakeholder suggests executive training.
What should it focus on?",Quality management,Stakeholder management,Cost management,Risk management,,3,,"Learning cost management helps Samah weigh resource additions against
outcomes.",,,,,,1500_questions.txt
18,"Holly, PM for the UIM Project, gets a change request approved by the
CCB. What's not a result of this change?",WBS updates,Scope updates,WBS dictionary updates,Charter updates,,4,,"The charter isn't revised for approved changes---scope, WBS, and
dictionary are.",,,,,,1500_questions.txt
19,Which isn't a quality management process?,Quality definition,Quality control,Quality assurance,Quality planning,,1,,"Quality definition isn't a formal PM process; the others are core to
quality management.",,,,,,1500_questions.txt
20,Select two items a PM includes in a team charter.,Team values,Decision-making criteria,Team responsibilities,Team assignments,,,"1,2","The team charter sets norms and expectations like values and
decision-making, not specific assignments.",,,,,,1500_questions.txt
21,What's an input to Identify Stakeholders?,Project management plan,Stakeholder register,Procurement documents,Stakeholder analysis,,3,,Procurement documents help identify stakeholders tied to contracts.,,,,,,1500_questions.txt
22,"A PM arranges quality training for the team about the final product.
What COQ category is this?",Internal failure,Prevention,External failure,Appraisal,,2,,Training to ensure quality upfront is a prevention cost.,,,,,,1500_questions.txt
23,"On a control chart, three points are below the mean within limits, four
are above and outside. How's the process?",Out of control,Under the seven-point rule,Within spec limits,In control,,4,,"Points outside limits suggest an out-of-control process, but the
question implies review, aligning with control assessment.",,,,,,1500_questions.txt
24,"You're kicking off a project with stakeholders, team, and management.
What's this meeting called?",Requirements gathering,Risk identification,Team development,Kick-off,,4,,A kick-off meeting launches the project and aligns participants.,,,,,,1500_questions.txt
25,"Samantha, scrum master for Project Y in planning, is asked how to budget
an agile project. What's her likely reply?",You can't---it's pay-as-you-go,Switch to a predictive model,"Estimate initially, tweak later",Ask the product owner,,3,,Agile budgets start with knowns and adjust as scope evolves.,,,,,,1500_questions.txt
26,"An IT manager confirms no quality control failures for a new system.
What's the PM's next step?",Begin closure,Hand off to the client,Share the final report,Validate scope with sponsor,,4,,Scope validation ensures formal acceptance before closure.,,,,,,1500_questions.txt
27,"A developer transitioning to PM manages a security feature project. By
resolving issues actively, what's her goal?",Enhance skills,Allocate resources,Optimize performance,Boost team interaction,,3,,"Managing issues optimizes project performance per the Manage Team
process.",,,,,,1500_questions.txt
28,"A construction PM builds a WBS for a large project. What aids its
creation?",Gantt chart,Activity list,Subcontractor pricing,Requirements docs,,2,,"An activity list details tasks, supporting WBS development.",,,,,,1500_questions.txt
29,"Alice's project, ahead of schedule, gets extra quality testing approved.
What's this an example of?",Quality assurance,Scope creep,Integrated change control,Change control,,3,,Integrated change control manages this approved scope addition.,,,,,,1500_questions.txt
30,Select three costs of quality.,Quality staff,Rework,Time on quality tasks,Quality tools,,,"1,3,4","Quality costs include staff, tools, and time invested in quality
activities.",,,,,,1500_questions.txt
31,"An IT hardware PM finds failing component batches. What tool reduces
failure rates?",Control chart,Tornado diagram,Probability/impact matrix,Fishbone diagram,,4,,A fishbone diagram identifies root causes of failures.,,,,,,1500_questions.txt
32,"A PM delivers completed project deliverables to the client's PM while
the client is away. Later, approval is rejected. What should've been
done?",Ensured quality deliverables,Escalated client absence,Got sign-off from a rep,Specified payment terms,,3,,A representative's sign-off ensures formal acceptance.,,,,,,1500_questions.txt
33,"Thomas, team lead, is asked if a release is doable in three sprints.
Past sprints hit 20, 25, and 30 points; 90 points remain. What's his
answer?","No, average is 25 points","Yes, velocity will rise",Add team members,"Team decides, not me",,1,,"With a 25-point average, 90 points exceeds three sprints' capacity.",,,,,,1500_questions.txt
34,"You're creating a unique TV series for November sweeps. What's true
here?",It's a project---unique with set dates,It's operations---series creation is routine,It's ongoing---series lasts years,It's not unique---firm makes series,,1,,A project has a defined start and end; this ends at sweeps week.,,,,,,1500_questions.txt
35,"A developer suggests a cost-free performance boost during execution.
What's the PM's first step?",Check performance data,Implement without delay,Have a tech lead review,Document for change control,,3,,A technical review ensures feasibility before formal steps.,,,,,,1500_questions.txt
36,"You're deciding to buy or build software for a late project. In what
process is make-or-buy analysis used?",Initiating,Procurement planning,Contract closeout,Source selection,,2,,Make-or-buy analysis occurs in procurement planning.,,,,,,1500_questions.txt
37,"Bevan's elevator project has phased milestones. What term describes
these work segments?",Phase gate,Project governance,Project phase,Project life cycle,,3,,A project phase groups related activities to a deliverable.,,,,,,1500_questions.txt
38,What's a tool/technique in Manage Project Team?,Org charts,Ground rules,Org theory,Conflict management,,4,,Conflict management aids team oversight.,,,,,,1500_questions.txt
39,"Jason, a PM, aims to boost EI and reward his team to meet a tight
deadline. What's the best reward?",Promise a \$500 bonus,Thank each member personally,Praise them to supervisors,Give top two early leave,,2,,Personal thanks show EI and motivate broadly.,,,,,,1500_questions.txt
40,An SPI below 1.0 means what?,Project lags planned value,EV is fully achieved,Time loss is permanent,No concern despite delay,,1,,SPI \< 1 shows less work done than planned.,,,,,,1500_questions.txt
41,"Ben, PM at ABC Corp, faces a team argument during a meeting. What's his
best resolution?",Address privately post-meeting,Escalate to their manager,Ignore if timeline's safe,Stop meeting to resolve,,4,,Immediate action reinforces norms and saves meeting time.,,,,,,1500_questions.txt
42,"A project, three weeks behind with two months left, can't use overtime.
How does the PM recover?",Over-allocate resources,Request scope change,Crash the schedule,Fast-track it,,4,,Fast-tracking overlaps tasks to regain time without extra cost.,,,,,,1500_questions.txt
43,"Judy shares with her project coach that her mother's health issues may
pull her away occasionally, stressing her need for work-life balance.
How should the coach respond?",Suggest she keep it private,Demand extra hours to cover absences,Ignore her concerns,Encourage sharing with the team for support,,4,,"Encouraging Judy to share comfortably fosters team support, aligning
with agile collaboration.",,,,,,1500_questions.txt
44,"Sean's team finds a missing requirement in a user story. A developer
discusses it with a key contact, but the tracking tool isn't updated.
What should Sean do?",Update the tool immediately,Limit talks without testers,Discuss at the next standup,Block changes outside backlog,,3,,"Raising it at standup prioritizes people over rigid process updates in
agile.",,,,,,1500_questions.txt
45,"You're managing a smartphone app project at SubZero Delights, plotting
uncertainty vs. requirement uncertainty. What model is this?",Agile Model,Stacey Complexity Model,Release Model,Shu-Ha-Ri Model,,2,,"The Stacey Complexity Model maps uncertainty and agreement to assess
project complexity.",,,,,,1500_questions.txt
46,"A client verbally okays a scope change, but it's not recorded. What's
the PM's next step?",Request a formal change from the client,Consult senior management,Update the project plan,Proceed while awaiting approval,,1,,Formalizing the request ensures proper change control.,,,,,,1500_questions.txt
47,"At Fun Days Vacation Packages, you align projects with strategic goals
for resource efficiency. What's this?",Project management,Program management,Portfolio management,Project and program management,,3,,Portfolio management aligns projects with strategic objectives.,,,,,,1500_questions.txt
48,Which diagram shows project activities and their logical links?,Gantt chart,Project schedule network diagram,Milestone list,Activity list,,2,,A network diagram illustrates activity dependencies.,,,,,,1500_questions.txt
49,"The charter is ready, but the sponsor, leaving in two weeks, delays
approval for the new sponsor. Stakeholders resist waiting. The sponsor
reschedules the meeting. What technique is this?",Prevention,Smoothing,Withdrawal,Forcing,,3,,Withdrawal pauses conflict by delaying the discussion.,,,,,,1500_questions.txt
50,"Amanda, scrum master for Project DBA, has final deliverables approved.
After lessons learned and product handoff, what's next?",Release the team,Plan support,Monitor operations,Close remaining tasks,,1,,"With closure complete, the team is released.",,,,,,1500_questions.txt
51,What do project management processes ensure?,Strategic alignment,Efficient objectives,Team performance,Smooth project flow,,4,,Processes ensure effective project progression.,,,,,,1500_questions.txt
52,"A PM estimates costs with an SME who underestimates effort. How should
the PM mitigate this?",Review estimates with the SME and others,Ignore past errors,Increase SME estimates by 20%,Replace the SME,,1,,Reviewing with additional input balances the SME's tendency.,,,,,,1500_questions.txt
53,"What model classifies stakeholders by power, urgency, and legitimacy?",Salience model,Stakeholder cube,Stakeholder register,Directions of influence,,1,,The salience model uses these three attributes.,,,,,,1500_questions.txt
54,"Jenny at Ayres Company tracks vendor performance ratings. What's this
called?",Incentive contract,Seller rating system,Procurement selection,Requirement,,2,,A seller rating system logs vendor performance for future decisions.,,,,,,1500_questions.txt
55,Which knowledge area manages project information flow?,Risk Management,Integration Management,Communications Management,Quality Management,,3,,Communications Management handles info distribution.,,,,,,1500_questions.txt
56,"In which team-building phase do members adjust habits to support the
team?",Performing,Storming,Norming,Forming,,3,,Norming is when team cohesion strengthens.,,,,,,1500_questions.txt
57,"Alfred takes a security PM role he's unqualified for, planning to learn
on the job. Which value does he neglect?",Responsibility,Honor,Honesty,Respect,,1,,Responsibility requires matching skills to roles.,,,,,,1500_questions.txt
58,"What document includes project purpose, objectives, milestones, and
budget summary?",WBS,Requirements doc,Project charter,Project management plan,,3,,The charter outlines these essentials.,,,,,,1500_questions.txt
59,Collecting requirements is foundational for what in scope management?,Scope management plan,WBS,Schedule,Scope change control,,2,,Requirements shape the WBS and scope.,,,,,,1500_questions.txt
60,"For a playground project, the sponsor questions a gap between foundation
and structure work. What's this gap called?",Free float,Project float,Lag,Lead,,3,,"Lag is the intentional delay, like curing time.",,,,,,1500_questions.txt
61,"Stark Solutions builds learning software with beta releases. What's not
suitable for the first beta?",Learner ID/password,Refer-a-friend feature,Issue reporting option,Sign-up/login interface,,2,,"Refer-a-friend isn't vital for an early, non-public beta.",,,,,,1500_questions.txt
62,"Morgan, PM for the Lucenda Project (third iteration), boosts team
performance, finishing early. How can she verify improvement?",Lower failure risk,Better quality,Faster market delivery,Higher satisfaction,,3,,Reduced time to market quantifies performance gains.,,,,,,1500_questions.txt
63,"Grant reports a \$30,000 equipment cost overrun to the sponsor, who
approves reserve funds. Where are these funds from?",Management reserves,Contingency reserves,Funding limit reconciliation,Cost baseline,,1,,Management reserves cover unexpected costs.,,,,,,1500_questions.txt
64,What defines operations?,Temporary activity execution,Unique endeavor,Oversight organization,Ongoing repetitive tasks,,4,,"Operations are ongoing, unlike temporary projects.",,,,,,1500_questions.txt
65,"A team member redirects a senior manager's update request to the PM.
What guides this?",RACI matrix,Communications plan,Stakeholder register,Last week's minutes,,1,,The RACI matrix defines roles for info sharing.,,,,,,1500_questions.txt
66,"A team member's disruptive behavior upsets stakeholders. What skill does
he need most?",Interpersonal/team skills,Training,Ground rules,Team-building,,1,,Interpersonal skills address his behavior.,,,,,,1500_questions.txt
67,"The marketing director evaluates project proposals against company
goals. What's this?",Program management,Project management,Portfolio management,Agile management,,3,,Portfolio management aligns projects with strategy.,,,,,,1500_questions.txt
68,What's the diagram below?,Risk breakdown structure (RBS),Project team,SWOT Analysis,Work breakdown structure (WBS),,1,,An RBS organizes risks by category.,,,,,,1500_questions.txt
69,"Beth, PM for Project L (nine weeks in, CPI 0.95, SPI 0.98), learns a
stakeholder missed updates despite weekly emails. What's next?",Tell them to check email,Do nothing,Send a special email,Find their preferred method,,4,,Tailoring communication to their preference improves engagement.,,,,,,1500_questions.txt
70,"Edward facilitates a hybrid project meeting with diverse stakeholders.
What should he do first?",Set ground rules with attendees,Agree on scope and expectations,Use force field analysis,Promote positive behaviors,,1,,Ground rules set the tone for productive discussion.,,,,,,1500_questions.txt
71,Which tool divides project scope into manageable parts?,Decomposition,Inspection,Project analysis,Document analysis,,1,,Decomposition breaks down scope and deliverables.,,,,,,1500_questions.txt
72,When does risk monitoring and control happen?,Initiation,Work performance analysis,Project lifespan,Milestones,,3,,It's ongoing throughout the project.,,,,,,1500_questions.txt
73,A weighting system aids what in Conduct Procurements?,Plan contracting,Request seller responses,Select sellers,Plan purchases,,3,,It evaluates vendors for selection.,,,,,,1500_questions.txt
74,What's an input to Create WBS?,Requirements documentation,Scope baseline,Project charter,Validated deliverables,,1,,Requirements guide WBS creation.,,,,,,1500_questions.txt
75,"Julie's team uses personas to fix project issues. What problem did they
likely face?",Overfocus on one scenario,Lack of user-valued features,Product owner intrusion,Poor standup communication,,2,,Personas refocus on user value.,,,,,,1500_questions.txt
76,"Raj, PM at Miller Homes, walks through each phase with the client for
approval. What's this process?",Quality assurance,Quality control,Scope validation,Earned value management,,3,,Scope validation ensures formal deliverable acceptance.,,,,,,1500_questions.txt
77,"Bianca oversees a global project with stakeholders spread across the
United States, Mexico, and France. When planning communication
assumptions and constraints, which of these represents a communication
constraint for her project?",Stakeholder management,Requests for formal reports,Casual chats via web conferencing tools,The project team's geographic locations,,4,,"The team's geographic spread poses a communication constraint due to
physical distance, complicating interactions. The other options don't
inherently limit communication.",,,,,,1500_questions.txt
78,What do the ISO 9000 standards offer?,Guidelines on product manufacturing processes,Detailed steps for quality system implementation,A basic framework for quality systems,Maximum process standards to guarantee customer satisfaction,,3,,"ISO 9000 outlines core requirements for a quality system without
dictating specific implementation details.",,,,,,1500_questions.txt
79,What's excluded from project selection methods?,Alternatives analysis,NPV calculations,Benefit measurement methods,Constrained optimization analysis,,1,,"Benefit measurement and constrained optimization (mathematical models)
are essential to project selection, while alternatives analysis and cash
flow analysis are optional tools.",,,,,,1500_questions.txt
80,"Ken manages a project with virtual teams across multiple time zones. In
week three of deployment, a team complains about early meeting times.
How should Ken address this?",Ignore it---teams must adapt to time zones,Shift meetings to suit the majority,Rotate meeting times to balance the burden,Adjust meetings to favor the complaining team,,3,,"Rotating meeting times ensures fairness across all teams, boosting
morale. Favoring one group or ignoring the issue risks alienating
others.",,,,,,1500_questions.txt
81,"The sponsor of a delayed project proposes cutting quality assurance
testing time. What should the project manager do?",Conduct quality control checks,Stick to the quality management plan,Run quality audits,Alter the quality standards,,4,,"Adjusting quality requirements via change control maintains project
integrity rather than bypassing the established plan.",,,,,,1500_questions.txt
82,"Abigail wants to craft a burndown chart for her team's wall to track
progress. What's her next step before starting?",Decide if risk should be factored in,Skip ahead---none of the above,Choose between tracking hours or story points,Begin creating the chart right away,,3,,"She must decide whether to track hours or points, as this defines the
chart's structure. Risk isn't typically included, and starting without
this choice delays clarity.",,,,,,1500_questions.txt
83,"During a project's kickoff, the project manager finds gaps in the
business case. What's the best course of action?",Log the gap as a risk,Use the SOW to draft the charter,Revise the business case to limit scope,Confirm alignment with the sponsor's needs,,4,,"Reviewing with the sponsor ensures the project aligns with business
goals before proceeding.",,,,,,1500_questions.txt
84,"Eddie, a metalworking expert, is reassigned to a construction project
and feels unprepared. With help from construction veterans, how can he
maximize business value?",Test at every stage,Refine the backlog,Embrace servant leadership,Use continuous integration,,3,,"Servant leadership leverages team support and transparency, helping
Eddie deliver value despite his unfamiliarity.",,,,,,1500_questions.txt
85,Which list includes processes within Project Procurement Management?,"Plan purchases, plan contracting, request seller responses, select
sellers","Plan purchases, request seller responses, select sellers, schedule
control","Plan purchases, acquire team, request seller responses, select
sellers","Plan purchases, acquire team, contract approval, select sellers",,1,,"These four processes align with procurement management's core
activities.",,,,,,1500_questions.txt
86,"For the four-year Ellingsworth Project with 25 stakeholders, when should
Priya identify risks?",Just at the start,During execution only,Once per phase,Throughout the project,,4,,"Risk identification is ongoing, adapting to new risks as the project
evolves.",,,,,,1500_questions.txt
