id,statement,option1,option2,option3,option4,option5,correct_answer,correct_answers,explanation,erro_alternative1,erro_alternative2,erro_alternative3,erro_alternative4,erro_alternative5,source
332,"Marissa, in a weak matrix, sees her small team juggling priorities and
clashing over duties. What should she create with them?",Business case,Gantt chart,RACI matrix,Roles chart,,3,,A RACI matrix clarifies who's accountable and responsible.,,,,,,1500_questions.txt
333,"Tim, scrum master for Project B, worries the team took on too little
this sprint. They say they're fine. How can he check?",Check velocity against progress.,Trust their word as the doers.,Review time cards for hours.,Observe them directly.,,1,,Velocity offers an objective progress measure.,,,,,,1500_questions.txt
334,"What activity involves presenting team roles, training, and rewards to
the sponsor for approval?",Build the resource plan.,Shape stakeholder engagement.,Spot resource risks.,Estimate project costs.,,1,,The resource plan covers these elements for approval.,,,,,,1500_questions.txt
335,"A new regulation adds financial needs, and a stakeholder requests an
extra activity. What's the project manager's step?",Do it since it's a key stakeholder.,Log it and start change procedures.,Shift funds from other tasks.,Update the schedule for it.,,2,,Change requests ensure proper process adherence.,,,,,,1500_questions.txt
336,When is project uncertainty and failure risk highest?,Final stretch,Kickoff,Wrap-up,Midpoint,,2,,Uncertainty peaks at the start with unknowns aplenty.,,,,,,1500_questions.txt
337,"Jared's agile team at Morgan Consulting has generalizing specialists.
What defines them best?",They grasp all role duties.,They excel in multiple areas.,They ace their own tasks.,They master one skill.,,2,,Generalizing specialists bring versatility to teams.,,,,,,1500_questions.txt
338,"A new product flops due to misalignment with core strengths. When should
this have been caught?",Business case check,Strategic review,What-if analysis,Scope setting,,2,,Strategic evaluation aligns projects with company goals.,,,,,,1500_questions.txt
339,"Who theorized motivation via power, achievement, and affiliation needs?",David McClelland,Victor Vroom,Frederick Herzberg,Douglas McGregor,,1,,McClelland's Achievement Theory nails this trio.,,,,,,1500_questions.txt
340,Insuring against risks in management is termed what?,Transference,Avoidance,Exploring,Mitigation,,1,,"Transference shifts risk to another party, like insurance.",,,,,,1500_questions.txt
341,"Stakeholder disputes over requirements delay charter approval. What's
the project manager's play?",Escalate to the sponsor.,Cut conflicting needs.,Resolve via conflict tactics.,Analyze benefits with stakeholders.,,3,,Conflict resolution keeps the process moving.,,,,,,1500_questions.txt
342,Which technique aids in crafting a project charter?,PM info systems,Expert insight,Change control sessions,Brainstorming,,2,,Expert judgment shapes a solid charter.,,,,,,1500_questions.txt
343,"While mapping system links, a project manager uncovers two overlooked
risks tied to another. What technique is this?",Flow chart,Influence diagram,Cause-effect chart,Control chart,,1,,Flow charts reveal system interconnections and risks.,,,,,,1500_questions.txt
344,"Stella's Server Update Project at Clark Financial has 247 stakeholders,
mostly end-users upset about data changes. They're complaining to
managers. What stakeholder type are they?",Unresponsive,Negative,Uninformed,Low influence/low interest,,2,,Negative stakeholders resist the project's goals.,,,,,,1500_questions.txt
345,"For a construction project, the team plans to sync field changes with
office blueprints. What's this process?",Configuration management,Change assessment,PM planning,Scope validation,,1,,Configuration management ensures consistency across updates.,,,,,,1500_questions.txt
346,Which best contrasts attribute sampling with variables sampling?,Attribute sampling prevents; variables sampling inspects.,Attribute sampling checks yes/no; variables sampling measures depth.,"Attribute sampling spots special causes; variables sampling tracks
all.",They're identical concepts.,,2,,Attribute sampling is binary; variables sampling scales conformity.,,,,,,1500_questions.txt
347,"A sponsor seeks software to store, analyze, and report project data.
What system is this?",Change control suite,PM info system,Earned value tool,Reporting platform,,4,,A reporting system fits these broad needs.,,,,,,1500_questions.txt
348,"Mia's tight-schedule project hits a snag: two team members disagree, and
she picks the senior one's idea. What's this called?",Forcing,Compromising,Withdrawal,Problem-solving,,1,,Forcing overrides debate with authority.,,,,,,1500_questions.txt
349,What defines a project lifecycle?,"A set of phased, sometimes overlapping stages.",A process ensuring only needed work is done.,A PM profession standard.,Applying skills to meet requirements.,,1,,Lifecycles structure project phases uniquely.,,,,,,1500_questions.txt
350,"A project manager spots process flaws while reviewing constraints. What
Manage Quality tool is in play?",Quality audits,Quality tools,Process analysis,Cost-benefit review,,3,,Process analysis targets inefficiencies head-on.,,,,,,1500_questions.txt
351,"A stakeholder's unapproved scope tweak was rejected for budget reasons,
but funds later free up. What document guides resubmission?",Change log,Issue log,Risk register,Stakeholder register,,1,,The change log tracks prior requests.,,,,,,1500_questions.txt
352,When do stakeholders formally accept completed scope?,Quality control,Scope verification,Scope control,Schedule development,,2,,Verify Scope locks in acceptance.,,,,,,1500_questions.txt
353,"Penny, scrum master for APPDEV54, adds a quality check task to the
backlog, but the product owner resists. Why might she insist?",She fears project failure.,The team needs busywork.,She yields to the owner.,Team flags code issues.,,4,,Quality checks catch reported flaws early.,,,,,,1500_questions.txt
354,Which baselines form the performance measurement baseline?,"Scope, cost, schedule","Scope, PM, quality","Cost, schedule, risk","Cost, PM, schedule",,1,,These three anchor performance tracking.,,,,,,1500_questions.txt
355,"A stakeholder abroad feels out of the loop despite updates. How can the
project manager boost their engagement?",Meet for custom reports.,Address specific gripes with tailored updates.,Link stakeholders via social tools and media.,Escalate to management.,,3,,Tech-savvy pull methods enhance inclusion.,,,,,,1500_questions.txt
356,Which technique supports the Define Activities process?,Rolling wave planning,Precedence diagramming,Alternatives analysis,Parametric estimating,,1,,Rolling wave refines activities progressively.,,,,,,1500_questions.txt
357,"Deciding between in-house or outsourced engineering design relies on
which plan?",Resource management,Procurement management,Schedule management,Engineering management,,1,,Resource planning guides such calls.,,,,,,1500_questions.txt
358,"For a rehab project's excavation permit, health and safety plans are
set. Post-approval, what's done with them?",Send to sponsors.,Share with team and contractors.,Archive as confidential.,Distribute to neighbors.,,2,,Transparency ensures safety compliance.,,,,,,1500_questions.txt
359,"Drew's software project lags on core parts despite ready features. How
can he deliver value now?",Acceptance test-driven dev,Backlog grooming,Incremental deliverables,Multi-level testing,,3,,Increments deliver usable value fast.,,,,,,1500_questions.txt
360,"In which contract are targets set early, with final price tied to
performance post-completion?",Firm-Fixed-Price,Fixed Price with Adjustments,Fixed-Price-Incentive-Fee,Cost Plus Fixed Fee,,3,,FPIF ties cost to outcomes.,,,,,,1500_questions.txt
361,Paul's Lean team at General Products cuts waste by minimizing what?,Late calls on work.,"Excess features, delays, and half-done tasks.",Product refactoring.,Customer value.,,2,,Lean trims non-value-adding efforts.,,,,,,1500_questions.txt
362,Deliverables checked for accuracy in Control Quality are called what?,Verified deliverables,Validated deliverables,Acceptance criteria,Resource needs,,1,,Verified means quality-checked.,,,,,,1500_questions.txt
363,"A pipeline project's CPFF contractor estimates \$50,000 with a \$5,000
fee, but costs hit \$60,000. What's the payout?","\$65,000","\$60,000","\$55,000","\$50,000",,1,,"CPFF covers actual costs plus fee: \$60,000 + \$5,000.",,,,,,1500_questions.txt
364,What's the product scope description for?,Rally stakeholder backing.,Detail product traits.,Outline the project fully.,Authorize the project.,,2,,It defines what the product is.,,,,,,1500_questions.txt
365,"In a functional org with a consultative PMO, you're asked for a doc on
resource skill needs. What do you provide?",Resource requirements,Resource breakdown,Activity list,Team assignments,,1,,Requirements specify skill levels needed.,,,,,,1500_questions.txt
366,"Emily's team at Kitchen Tables finishes code, tests later, and fixes
issues. How can waste be cut?",Cut issue-talk delays.,End the testing wait.,Stop daily status lags.,Drop paired programming delays.,,2,,Waiting is waste; faster testing trims it.,,,,,,1500_questions.txt
367,"In Azure DevOps, Brian's lagging on tasks for three sprints. How should
you address this?",Meet to delegate his load.,Discuss reasons and solutions.,Move him to a lighter project.,Give him a sprint to improve.,,2,,Talking uncovers root causes and fixes.,,,,,,1500_questions.txt
368,What shapes Agile approach use most?,Org culture,PM knowledge,PMO presence,Org maturity,,1,,Culture drives Agile fit and adoption.,,,,,,1500_questions.txt
369,How does a context diagram function?,Shows product scope,Traces requirements,Builds scope plan,Sets requirements plan,,1,,It visually maps product scope interactions.,,,,,,1500_questions.txt
370,"A project's estimates are: Most Likely 100 days, Pessimistic 250 days,
Optimistic 75 days. What's the expected value?",120.83 days,141.66 days,108.33 days,195.33 days,,1,,PERT formula: (75 + 250 + 4×100) ÷ 6 = 120.83.,,,,,,1500_questions.txt
371,"A 13-month infra project misses a vendor delivery. Where should the
project manager confirm the schedule?",Traceability matrix,Milestone list,Requirements plan,Assumption log,,3,,The requirements plan tracks deliverables.,,,,,,1500_questions.txt
372,"Rowena, on the Monogram Project, spots a revenue opportunity. What's the
best risk response?",Escalate,Share,Enhance,Exploit,,1,,Escalating fits org-level opportunities.,,,,,,1500_questions.txt
373,"A sponsor needs a cost estimate for a new manufacturing line. What
should the project manager give?",Rough order estimate,Budget-constrained figure,Precise final tally,Reserve-included estimate,,1,,ROM suits early-stage guesses.,,,,,,1500_questions.txt
374,Which action cuts the odds or impact of risk events?,Preventive steps,Risk management,Corrective moves,Defect fixes,,1,,Prevention targets risk reduction upfront.,,,,,,1500_questions.txt
375,"As the newly appointed head of marketing at a telecom firm, Harry
recently sat down with his top project manager to evaluate a project
he's sponsoring. He requests insight into the project's expected
business value and how it'll be tracked. Which document will the project
manager present to Harry?",The requirements traceability matrix,The project management plan,The product backlog,The benefits management plan,,4,,"The benefits management plan outlines how and when project benefits will
materialize, detailing target outcomes, strategic fit, timelines,
metrics for measurement, and other essentials tied to business value.",,,,,,1500_questions.txt
376,"Paul, scrum master for Project S, is in its tenth sprint with a velocity
of 96 story points and \$9,000 under budget. The team spans six time
zones, and after a recent standup, Paul asked their thoughts on
communication. What's likely driving his question?",He suspects some team members struggle to communicate.,He thinks some are slacking off.,He feels the velocity's too low.,He's exploring ways to improve virtual teamwork.,,4,,"Paul aims to enhance virtual collaboration by engaging the team for
insights. No evidence suggests poor performance or communication issues,
and velocity concerns don't align with the context.",,,,,,1500_questions.txt
377,"While planning a project, the project manager flags multiple risks, two
of which could derail everything. What's the next step based on this?","Conduct qualitative and quantitative risk analyses to decide the
approach.",Alert all stakeholders and draft quick contingency plans.,Adjust the WBS to add preventive tasks.,"Calculate contingency costs and suggest canceling if they're too
high.",,1,,"Both analyses are key to understanding and addressing risks
comprehensively.",,,,,,1500_questions.txt
378,"Ralph, project manager at Storm Health, has faced challenges since
starting. His boss notes a weak PM skill after Ralph dodged questions on
project alignment with company goals at a kickoff, calling it
irrelevant. Which skill needs work?",Communication skills,Business management and strategic skills,Technical project management skills,Leadership skills,,2,,"Strategic skills tie projects to org goals, a gap Ralph shows per the
PMI Talent Triangle®.",,,,,,1500_questions.txt
379,Which isn't a value in the Code of Ethics and Professional Conduct?,Honor,Responsibility,Fairness,Respect,,1,,"The code highlights responsibility, respect, fairness, and honesty---not
honor.",,,,,,1500_questions.txt
380,"When a project's uncertainty and complexity grow, what else rises?",Likelihood of change,Need for planning,Likelihood of re-planning,Need for longer iterations,,1,,"Higher uncertainty boosts change probability, often increasing rework
too.",,,,,,1500_questions.txt
381,What's a shared trait across all project life cycles?,Degree of uncertainty,Degree of planning,Degree of unfinished work,Degree of work sequencing,,2,,"Per the Agile Practice Guide, planning is universal, varying only in
timing and depth.",,,,,,1500_questions.txt
382,"You're managing a two-year project and working with your team to
pinpoint constraints and assumptions. At an analysis meeting, the
sponsor asks when most of the budget will be spent. What's your answer?",During initiation processes,During control processes,During planning processes,During execution processes,,4,,"Execution eats up the bulk of the budget, not the other phases.",,,,,,1500_questions.txt
383,"Betty wants her team to adopt agile handling of technical debt,
expecting task-doers to mainly focus on:",Scheduling at least 5% of each sprint for refactoring,Spotting refactoring chances in paired programming,Embedding refactoring in every estimate,None of these,,3,,"Agile bakes refactoring into every story estimate, not as a separate or
post-task fix.",,,,,,1500_questions.txt
384,"You've wrapped up project work and are doing quality control before
scope validation. Management wants to review all change requests'
statuses---approved or declined. Where's this info?",The risk register,Only approved changes are logged,Only declined changes are logged,The change log,,4,,"The change log tracks all requests, approved or not, unlike the risk
register.",,,,,,1500_questions.txt
385,"Using control charts to check process stability, the project manager
notes customer-set limits and eight consecutive points above the mean
from 18 data points. What's the conclusion?",The process is unstable.,Adjust the limits.,Escalate to the sponsor.,The process is stable.,,1,,Eight points above the mean signals an out-of-control process.,,,,,,1500_questions.txt
386,How's quality control carried out?,Setting relevant standards and figuring out compliance,Tracking results against standards and fixing issues,Training the team in QA processes,Using Monte Carlo and benchmarking for standards,,2,,It's about monitoring outputs and correcting deviations.,,,,,,1500_questions.txt
387,"Al, a test lead, and Veronica, a dev manager, face a team conflict
delaying milestones at Power Cloud Stock Trading Online. They seek the
project manager. Who resolves the team clash?",The two team members,The project manager,The project sponsor,The functional manager,,1,,"Team members should handle it directly unless formal escalation is
needed.",,,,,,1500_questions.txt
388,"Frank, scrum master for Project Minnesota in its first sprint, discussed
acceptable behavior in the team's space at a meeting. Why focus on this?",To call out a troublemaker,The team's been disruptive,To foster a positive workspace,It was on the agenda,,3,,"Defining norms reinforces a good environment; no signs point to
misbehavior.",,,,,,1500_questions.txt
389,"Grace's team, after a few sprints, is debating solutions constructively.
What stage are they likely in?",Storming,Norming,Forming,Performing,,1,,Storming involves challenges as they learn to collaborate.,,,,,,1500_questions.txt
390,Work performance info feeds into which process?,Contract administration,Project execution direction,WBS creation,Qualitative risk analysis,,1,,It's an input to managing contracts.,,,,,,1500_questions.txt
391,"In a weak-matrix org, two months into a four-month project, the
functional manager plans to reassign half your key resources. You warn
it could end the project early. What's likely?",Resources stay put.,Resources get reassigned.,The budget gets pulled.,"You quit, ending the project.",,2,,"In a weak matrix, functional managers hold more sway.",,,,,,1500_questions.txt
392,"Your project uses secret manufacturing techniques your org patented. A
knowledgeable team member advises others internally but not externally.
What power type is this?",Punishment,Situational,Referent,Expert,,4,,Expert power stems from deep subject knowledge.,,,,,,1500_questions.txt
393,"Sharon's self-managing team on Project Blueharmony is coding a bank
software migration. She finds substandard original code while adding
features. What's her best move?",Update the sprint backlog,Raise it in the daily scrum,Revise the sprint goal,Cancel the sprint,,2,,"Discussing it daily ensures team input; she can't unilaterally change
goals or cancel.",,,,,,1500_questions.txt
394,"Terry, a quality engineer, needs time and tools for quality control.
Which isn't a quality control tool she'd use?",Control charts,Baseline updates,Flowcharting,Inspection,,2,,Baseline updates aren't tools; the others track quality.,,,,,,1500_questions.txt
395,"A project manager at a global firm faces brand ID issues and suggests a
marketing consultant. What technique is this?",Data analysis,Data gathering,Expert judgment,Decision making,,3,,Expert input drives this solution.,,,,,,1500_questions.txt
396,"For the NJQ Project, you've made a chart with a circled area. What's it
called?",Out of control,Within control,Rule of seven,Quality improvement,,3,,"Seven points on one side of the mean is the Rule of Seven, signaling a
cause.",,,,,,1500_questions.txt
397,"Management questions your team's ground rules. Which statement about
them is false and needs tweaking?",They boost productivity.,They lift satisfaction.,The PM sets them.,They set expectations.,,3,,"Teams, not just the PM, craft ground rules collaboratively.",,,,,,1500_questions.txt
398,"Creating a cost management plan with a hybrid approach, you settle with
the sponsor and CFO on rounding to thousands and using weeks for
resources. What elements are these?",Units of measure and control thresholds,Rules of performance and accuracy level,Control thresholds and units of measure,Accuracy level and units of measure,,4,,Rounding is accuracy; weeks are units of measure.,,,,,,1500_questions.txt
399,"A PMO leader steers Agile adoption. Pick three traits to assess
readiness.",Management's openness to change,Org's willingness to shift views,Short-term budget focus,Long-term goal focus,,,"1,2,3","Readiness hinges on management and org flexibility, plus short-term
adaptability.",,,,,,1500_questions.txt
400,"Phil, managing Project SPA at QuickSolve, uses a predictive approach for
a circuit board. Ahead of schedule and on budget, he finds a skill gap
for a two-day task that risks \$12,000 and a week's delay. How should he
mitigate?",Hire a contractor with reserves,Tap the PMO for an expert,Delay the task for training,Halt for risk analysis,,2,,PMO expertise mitigates without shifting the plan.,,,,,,1500_questions.txt
401,"The CEO questions a vendor's \$50,000 monthly bill, wondering if
deliverables justify it. What should the project manager provide?",Performance specs,Seller evaluation,Procurement plan,Contract admin plan,,2,,Seller performance data answers the CEO's query.,,,,,,1500_questions.txt
402,"Eric, scrum master, and product owner Chris plan a sprint. An epic's
story points exceed velocity, but Chris wants it in. What's next?",Business value check,Rolling wave planning,Incremental dev,Task breakdown,,4,,Decomposing the epic fits it into the sprint.,,,,,,1500_questions.txt
403,"A critical task issue stalls the project, with no contingency fix and
team disagreement. What should the project manager do?",Brainstorm with nominal group,Use affinity diagrams,Call the sponsor,Mind map solutions,,1,,Nominal group technique resolves disputes efficiently.,,,,,,1500_questions.txt
404,"Stephen, new to your agile software project from a predictive
background, needs agile basics. Which method isn't best for him?",Check the org's knowledge base,Research independently,Stick to predictive ways,Learn from teammates,,3,,Predictive habits won't help him adapt to agile.,,,,,,1500_questions.txt
405,"Josh, a junior dev, is three sprints in with 94 velocity. Mid-sprint,
the team finished early, and senior dev Shelley told him to grab the
next backlog item. Why?",Shelley got scrum master approval.,It was missed in planning.,They need to look busy.,It's stakeholder-prioritized.,,4,,Backlog priority guides extra work when capacity allows.,,,,,,1500_questions.txt
406,What's the tool for requesting seller responses?,Procurement docs,Expert judgment,Bidder conferences,Contract types,,3,,Bidder conferences solicit responses.,,,,,,1500_questions.txt
407,"Larry, scrum master for Project Columbus, foresaw a vendor delay risk
that's now hit, risking a milestone. What's his next move?",Wait for the risk owner,Alert the team,Check the risk register,Escalate to the product owner,,3,,The risk register guides the response.,,,,,,1500_questions.txt
408,The level of risk an org or person can handle is its risk:,Analysis,Appetite,Tolerance,Response,,3,,Tolerance defines acceptable risk limits.,,,,,,1500_questions.txt
409,"Frank, scrum master for Project Dragonfly's first sprint, guides a new
agile team through scrum. Which ceremony plans their work?",Initiation event,Sprint review,Kickoff meeting,Sprint planning,,4,,Sprint planning sets the sprint's work from the backlog.,,,,,,1500_questions.txt
410,"At project closure, stakeholders dispute success criteria and have been
frustrated throughout. What should the project manager reference?",Project charter,Quality management plan,Scope statement,Requirements docs,,2,,Quality plans address success metrics.,,,,,,1500_questions.txt
411,Which activity ensures a project's configuration items are correct?,Config identification,Config status accounting,Config verification and audit,Config quality assurance,,3,,Verification confirms item accuracy.,,,,,,1500_questions.txt
412,"Heather, scrum master for Project Z, is asked by the product owner why
she handles tasks like room booking. How should she reply?",Explain servant leadership,Complain about the team,Point to ground rules,Ask the owner to do it,,1,,Servant leadership explains her supportive role.,,,,,,1500_questions.txt
413,"You've managed projects for a decade with a familiar team that sees you
as an expert and enjoys your leadership. What power do you wield on the
GHB Project?",Expert power,Referent power,Coercive power,Formal power,,2,,Team rapport reflects referent power.,,,,,,1500_questions.txt
414,"After a similar past success, a project manager wants lessons learned
for a new construction project. What data analysis technique fits?",Regression,Trend,Document,Variance,,3,,Document analysis pulls past insights.,,,,,,1500_questions.txt
415,"Your project underspent its phase-one budget, risking a cut in phase
two. You order better materials to hit the predicted cost, enhancing
quality. What's this called?",Effective cost management,Integrated change control,Gold plating,Parkinson's Law,,3,,Gold plating adds unneeded extras.,,,,,,1500_questions.txt
416,"Managing a transformation project in execution, your new
cross-functional team worries senior management about delivery. How do
you boost performance?",Turn issues into team-building chances,Get HR to add incentives,Pair team members by experience,Log it as a risk and report progress,,1,,Collaboration builds capability.,,,,,,1500_questions.txt
417,Requesting industry experts to suggest project fixes relies on:,Communication models,Stakeholder input,Expert judgment,Enterprise factors,,3,,Experts provide informed advice.,,,,,,1500_questions.txt
418,"Stakeholder Tera micromanages your team. She's a dominance/drive type
per DISC. How should you handle her?",Flatter her control,Ban her from meetings,Present organized updates,Assert your authority,,3,,Organized info satisfies her need to succeed.,,,,,,1500_questions.txt
419,What's a project sponsor's role in a functional org during execution?,Report progress to management,Help resolve issues fast,Deflect changes for the PM,Be a stakeholder sounding board,,2,,Sponsors aid issue resolution actively.,,,,,,1500_questions.txt
